{
  "schema": "knowledge-hub.paper.visual-annotation-expansion-web-run-bundle.v1",
  "status": "ready",
  "generatedAt": "2026-05-26T14:30:40Z",
  "decision": "ready_for_operator_web_batch_run",
  "nextRecommendedTranche": "visual_annotation_expansion_manual_output_capture",
  "bundleId": "visual_annotation_expansion_web_run_bundle_002",
  "sourceWebOutputTemplate": {
    "schema": "knowledge-hub.paper.visual-annotation-expansion-web-output-template.v1",
    "status": "ready",
    "reportRef": "eval/knowledgeos/reports/visual_annotation_expansion_web_output_template_002.v1.json",
    "outputTemplateRows": 24
  },
  "targetOutput": {
    "schema": "knowledge-hub.paper.visual-annotation-web-output.v1",
    "reportRef": "eval/knowledgeos/reports/visual_annotation_expansion_web_output_002.manual.json",
    "validationCommand": "PYTHONPATH=. python eval/knowledgeos/scripts/validate_visual_annotation_expansion_web_output.py",
    "allowedUse": "retrieval_hint_only",
    "strictEvidence": false,
    "citationGrade": false,
    "answerableWithoutTextEvidence": false
  },
  "scope": {
    "writes": "report_only",
    "apiCalls": false,
    "modelCalls": false,
    "webModelCalls": false,
    "manualOperatorWebModelRunRequired": true,
    "operatorBatchPromptRows": 3,
    "bundleArtifactRows": 6,
    "completedWebOutputRows": 0,
    "manualWebModelOutputRows": 0,
    "vectorIndexing": false,
    "strictEvidencePromotionRows": 0,
    "runtimeAnswerVisibleExposureRows": 0,
    "databaseMutationRows": 0,
    "indexMutationRows": 0,
    "reindexOrReembedRows": 0,
    "vaultScanRows": 0,
    "externalDownloadRows": 0,
    "answerabilityGateBypassRows": 0,
    "cropWriteRows": 0,
    "pageImageWriteRows": 0,
    "wholeImageWriteRows": 0,
    "wholeImageGptRows": 0,
    "candidateStoreMutationRows": 0,
    "canonicalParsedArtifactWriteRows": 0
  },
  "counts": {
    "sourceTemplateRows": 24,
    "batchRows": 3,
    "operatorPromptRows": 3,
    "fillTemplateRows": 3,
    "bundleArtifactRows": 6,
    "attachmentRefRows": 24,
    "placeholderRows": 24,
    "completedWebOutputRows": 0,
    "privatePathLeakRows": 0,
    "schemaViolationCount": 0
  },
  "batchBundles": [
    {
      "batchId": "visual_annotation_expansion_manual_run_packet_002_batch_01",
      "batchNumber": 1,
      "rowCount": 8,
      "promptRef": "eval/knowledgeos/reports/visual_annotation_expansion_web_run_bundle_002/batch_01_prompt.md",
      "fillTemplateRef": "eval/knowledgeos/reports/visual_annotation_expansion_web_run_bundle_002/batch_01_fill_template.v1.json",
      "attachmentRefs": [
        "eval/knowledgeos/reports/visual_annotation_expansion_attachment_pack_002/assets/01-clip-2021-p2-image_region-29c8942b4b.png",
        "eval/knowledgeos/reports/visual_annotation_expansion_attachment_pack_002/assets/02-mae-2021-p1-image_region-e3b2cace3b.png",
        "eval/knowledgeos/reports/visual_annotation_expansion_attachment_pack_002/assets/03-alexnet-2012-p6-image_region-bf79cf1040.png",
        "eval/knowledgeos/reports/visual_annotation_expansion_attachment_pack_002/assets/04-clip-2021-p2-image_region-c453ed1cde.png",
        "eval/knowledgeos/reports/visual_annotation_expansion_attachment_pack_002/assets/05-mae-2021-p1-image_region-4fec8160d0.png",
        "eval/knowledgeos/reports/visual_annotation_expansion_attachment_pack_002/assets/06-alexnet-2012-p8-image_region-0159a28636.png",
        "eval/knowledgeos/reports/visual_annotation_expansion_attachment_pack_002/assets/07-clip-2021-p15-image_region-ff64c7a303.png",
        "eval/knowledgeos/reports/visual_annotation_expansion_attachment_pack_002/assets/08-mae-2021-p2-image_region-7fbc5df66c.png"
      ],
      "rows": [
        {
          "batchId": "visual_annotation_expansion_manual_run_packet_002_batch_01",
          "batchNumber": 1,
          "sourceCandidateId": "visual-layout:clip-2021:image_region:2:2616032b2a9d352d",
          "paperId": "clip-2021",
          "candidateType": "image_region",
          "page": 2,
          "attachmentRef": "eval/knowledgeos/reports/visual_annotation_expansion_attachment_pack_002/assets/01-clip-2021-p2-image_region-29c8942b4b.png",
          "fillRequired": [
            "visualObservationStatus",
            "derivedTextForRetrieval",
            "visibleText",
            "retrievalKeywords",
            "uncertainty",
            "limitations"
          ],
          "targetRowTemplate": {
            "sourceCandidateId": "visual-layout:clip-2021:image_region:2:2616032b2a9d352d",
            "visualObservationStatus": "image_attached",
            "derivedTextForRetrieval": "Retrieval hint only: FILL_IN_FROM_ATTACHED_IMAGE.",
            "visibleText": "Visible fragments include: FILL_IN_VISIBLE_TEXT_ONLY.",
            "retrievalKeywords": [
              "FILL_IN_KEYWORD"
            ],
            "uncertainty": "FILL_IN_UNCERTAINTY.",
            "limitations": "Retrieval hint only, not evidence.",
            "strictEvidence": false,
            "citationGrade": false,
            "answerableWithoutTextEvidence": false
          }
        },
        {
          "batchId": "visual_annotation_expansion_manual_run_packet_002_batch_01",
          "batchNumber": 1,
          "sourceCandidateId": "visual-layout:mae-2021:image_region:1:258a60cc216d8130",
          "paperId": "mae-2021",
          "candidateType": "image_region",
          "page": 1,
          "attachmentRef": "eval/knowledgeos/reports/visual_annotation_expansion_attachment_pack_002/assets/02-mae-2021-p1-image_region-e3b2cace3b.png",
          "fillRequired": [
            "visualObservationStatus",
            "derivedTextForRetrieval",
            "visibleText",
            "retrievalKeywords",
            "uncertainty",
            "limitations"
          ],
          "targetRowTemplate": {
            "sourceCandidateId": "visual-layout:mae-2021:image_region:1:258a60cc216d8130",
            "visualObservationStatus": "image_attached",
            "derivedTextForRetrieval": "Retrieval hint only: FILL_IN_FROM_ATTACHED_IMAGE.",
            "visibleText": "Visible fragments include: FILL_IN_VISIBLE_TEXT_ONLY.",
            "retrievalKeywords": [
              "FILL_IN_KEYWORD"
            ],
            "uncertainty": "FILL_IN_UNCERTAINTY.",
            "limitations": "Retrieval hint only, not evidence.",
            "strictEvidence": false,
            "citationGrade": false,
            "answerableWithoutTextEvidence": false
          }
        },
        {
          "batchId": "visual_annotation_expansion_manual_run_packet_002_batch_01",
          "batchNumber": 1,
          "sourceCandidateId": "visual-layout:alexnet-2012:image_region:6:508eb98021de0fd7",
          "paperId": "alexnet-2012",
          "candidateType": "image_region",
          "page": 6,
          "attachmentRef": "eval/knowledgeos/reports/visual_annotation_expansion_attachment_pack_002/assets/03-alexnet-2012-p6-image_region-bf79cf1040.png",
          "fillRequired": [
            "visualObservationStatus",
            "derivedTextForRetrieval",
            "visibleText",
            "retrievalKeywords",
            "uncertainty",
            "limitations"
          ],
          "targetRowTemplate": {
            "sourceCandidateId": "visual-layout:alexnet-2012:image_region:6:508eb98021de0fd7",
            "visualObservationStatus": "image_attached",
            "derivedTextForRetrieval": "Retrieval hint only: FILL_IN_FROM_ATTACHED_IMAGE.",
            "visibleText": "Visible fragments include: FILL_IN_VISIBLE_TEXT_ONLY.",
            "retrievalKeywords": [
              "FILL_IN_KEYWORD"
            ],
            "uncertainty": "FILL_IN_UNCERTAINTY.",
            "limitations": "Retrieval hint only, not evidence.",
            "strictEvidence": false,
            "citationGrade": false,
            "answerableWithoutTextEvidence": false
          }
        },
        {
          "batchId": "visual_annotation_expansion_manual_run_packet_002_batch_01",
          "batchNumber": 1,
          "sourceCandidateId": "visual-layout:clip-2021:image_region:2:2642c8db8bd29d0a",
          "paperId": "clip-2021",
          "candidateType": "image_region",
          "page": 2,
          "attachmentRef": "eval/knowledgeos/reports/visual_annotation_expansion_attachment_pack_002/assets/04-clip-2021-p2-image_region-c453ed1cde.png",
          "fillRequired": [
            "visualObservationStatus",
            "derivedTextForRetrieval",
            "visibleText",
            "retrievalKeywords",
            "uncertainty",
            "limitations"
          ],
          "targetRowTemplate": {
            "sourceCandidateId": "visual-layout:clip-2021:image_region:2:2642c8db8bd29d0a",
            "visualObservationStatus": "image_attached",
            "derivedTextForRetrieval": "Retrieval hint only: FILL_IN_FROM_ATTACHED_IMAGE.",
            "visibleText": "Visible fragments include: FILL_IN_VISIBLE_TEXT_ONLY.",
            "retrievalKeywords": [
              "FILL_IN_KEYWORD"
            ],
            "uncertainty": "FILL_IN_UNCERTAINTY.",
            "limitations": "Retrieval hint only, not evidence.",
            "strictEvidence": false,
            "citationGrade": false,
            "answerableWithoutTextEvidence": false
          }
        },
        {
          "batchId": "visual_annotation_expansion_manual_run_packet_002_batch_01",
          "batchNumber": 1,
          "sourceCandidateId": "visual-layout:mae-2021:image_region:1:40b27e8b4073d98f",
          "paperId": "mae-2021",
          "candidateType": "image_region",
          "page": 1,
          "attachmentRef": "eval/knowledgeos/reports/visual_annotation_expansion_attachment_pack_002/assets/05-mae-2021-p1-image_region-4fec8160d0.png",
          "fillRequired": [
            "visualObservationStatus",
            "derivedTextForRetrieval",
            "visibleText",
            "retrievalKeywords",
            "uncertainty",
            "limitations"
          ],